{
  "schema_version": "misa.self_repair_run.v1",
  "run_id": "20260511-012500-skill-candidate-misa-skill-recovery-workflow-001",
  "candidate_id": "skill-candidate-misa-skill-recovery-workflow-001",
  "mode": "self-repair-draft",
  "status": "validated_draft",
  "attempts": 1,
  "write_scope": [
    "generated/skill-drafts",
    "generated/repair-plans",
    "runs/self-repair"
  ],
  "generated_files": [
    "generated/skill-drafts/misa-hermes-recovery-refinement.md",
    "generated/repair-plans/skill-candidate-misa-skill-recovery-workflow-001.json"
  ],
  "commands": [
    {
      "label": "validate:schemas",
      "command": "npm run validate:schemas",
      "exit_code": 0,
      "timed_out": false,
      "duration_ms": 1200
    }
  ],
  "safety": {
    "publication_allowed": false,
    "writes_persistent_memory": false,
    "touches_runtime": false,
    "starts_timer_or_service": false,
    "requires_human_publish_approval": true
  },
  "needs_human_review": false,
  "created_at": "2026-05-11T01:25:00Z"
}
